{
  "agent_warnings": [],
  "artifact_hashes": {
    "evidence_ledger": "490cbd0220238bc665b1f46ad2ce4fb6bd42d987ddaafe503f570a8fc26ec98b"
  },
  "catalyst_spec": {
    "clarification_questions": [],
    "material": {
      "crystal_structure": "fcc",
      "formula": "Pt"
    },
    "model": {
      "atom_ordering": "ase_default",
      "center": true,
      "kind": "bulk",
      "periodic_boundary_conditions": [
        true,
        true,
        true
      ],
      "supercell": [
        1,
        1,
        1
      ]
    },
    "modifications": [],
    "provenance": [
      {
        "claim_index": 0,
        "evidence_type": "user_supplied",
        "field": "material.formula",
        "value": "Pt"
      },
      {
        "claim_index": 1,
        "evidence_type": "user_supplied",
        "field": "material.crystal_structure",
        "value": "fcc"
      },
      {
        "claim_index": 2,
        "evidence_type": "user_supplied",
        "field": "model.kind",
        "value": "bulk"
      },
      {
        "claim_index": 3,
        "evidence_type": "user_supplied",
        "field": "model.supercell",
        "value": [
          1,
          1,
          1
        ]
      },
      {
        "claim_index": 4,
        "evidence_type": "user_supplied",
        "field": "model.periodic_boundary_conditions",
        "value": [
          true,
          true,
          true
        ]
      },
      {
        "claim_index": 5,
        "evidence_type": "user_supplied",
        "field": "model.center",
        "value": true
      },
      {
        "claim_index": 6,
        "evidence_type": "user_supplied",
        "field": "model.atom_ordering",
        "value": "ase_default"
      },
      {
        "claim_index": 7,
        "evidence_type": "user_supplied",
        "field": "requested_outputs",
        "value": [
          "cif",
          "vasp"
        ]
      }
    ],
    "requested_outputs": [
      "cif",
      "vasp"
    ],
    "schema_version": "0.1",
    "task_status": "ready"
  },
  "clarification_questions": [],
  "created_at": "2026-08-02T06:05:47+00:00",
  "field_sources": [
    {
      "claim_index": 0,
      "evidence_type": "user_supplied",
      "field": "material.formula"
    },
    {
      "claim_index": 1,
      "evidence_type": "user_supplied",
      "field": "material.crystal_structure"
    },
    {
      "claim_index": 2,
      "evidence_type": "user_supplied",
      "field": "model.kind"
    },
    {
      "claim_index": 3,
      "evidence_type": "user_supplied",
      "field": "model.supercell"
    },
    {
      "claim_index": 4,
      "evidence_type": "user_supplied",
      "field": "model.periodic_boundary_conditions"
    },
    {
      "claim_index": 5,
      "evidence_type": "user_supplied",
      "field": "model.center"
    },
    {
      "claim_index": 6,
      "evidence_type": "user_supplied",
      "field": "model.atom_ordering"
    },
    {
      "claim_index": 7,
      "evidence_type": "user_supplied",
      "field": "requested_outputs"
    }
  ],
  "producer_version": "ASE_auto_build/0.9.2",
  "request_id": "journal-agent-r1-smoke",
  "schema_version": "spec-proposal/v1",
  "task_status": "ready"
}
